{
  "schemaVersion": 1,
  "runId": "20251215-102530_BTCUSDT_k3f7a",
  "flowKey": "scheduled_month_week_report_v1",
  "status": "RUNNING",
  "createdAt": "2025-12-15T10:25:30Z",
  "updatedAt": "2025-12-15T10:28:10Z",
  "trigger": {
    "type": "SCHEDULER",
    "source": "flow1-every-4h"
  },
  "scope": {
    "symbol": "BTCUSDT"
  },
  "progress": {
    "currentStepId": "charts_1M_default_set_v1",
    "stepCounts": { "total": 3, "pending": 1, "running": 1, "succeeded": 1, "failed": 0 }
  },
  "steps": {
    "ohlcv_1M_bigquery_all_v1": {
      "stepType": "OHLCV_EXPORT",
      "status": "SUCCEEDED",
      "timeframe": "1M",
      "createdAt": "2025-12-15T10:25:31Z",
      "finishedAt": "2025-12-15T10:25:45Z",
      "dependsOn": [],
      "inputs": {
        "source": "bigquery",
        "dataset": "raw_ohlcv",
        "symbol": "BTCUSDT",
        "timeframe": "1M",
        "exportMode": "all"
      },
      "outputs": {
        "gcs_uri": "gs://artifacts-bucket/20251215-102530_BTCUSDT_k3f7a/1M/ohlcv_1M_bigquery_all_v1.json"
      }
    },
    "charts_1M_default_set_v1": {
      "stepType": "CHART_EXPORT",
      "status": "RUNNING",
      "timeframe": "1M",
      "createdAt": "2025-12-15T10:25:46Z",
      "dependsOn": ["ohlcv_1M_bigquery_all_v1"],
      "inputs": {
        "minImages": 3,
        "requests": [
          { "chartTemplateId": "ctpl_default_v1" },
          { "chartTemplateId": "ctpl_default_v2" },
          { "chartTemplateId": "ctpl_rsi_v1" },
          { "chartTemplateId": "ctpl_macd_v1" }
        ]
      },
      "outputs": {}
    },
    "llm_report_1M_month_summary_v1": {
      "stepType": "LLM_REPORT",
      "status": "PENDING",
      "timeframe": "1M",
      "createdAt": "2025-12-15T10:25:46Z",
      "dependsOn": ["ohlcv_1M_bigquery_all_v1", "charts_1M_default_set_v1"],
      "inputs": {
        "llm": {
          "promptId": "prompt_month_v1",
          "llmProfile": {
            "modelName": "gemini-2.0-flash",
            "temperature": 0.2,
            "candidateCount": 1,
            "maxOutputTokens": 2048,
            "responseMimeType": "application/json",
            "structuredOutput": {
              "schemaId": "llm_report_output_v1",
              "kind": "LLM_REPORT_OUTPUT"
            }
          }
        },
        "ohlcvStepId": "ohlcv_1M_bigquery_all_v1",
        "chartsManifestStepId": "charts_1M_default_set_v1",
        "previousReportStepIds": []
      },
      "outputs": {}
    }
  }
}


