{
  "schemaVersion": 1,
  "runId": "20251224-120000_BTCUSDT_a1b2c",
  "flowKey": "scheduled_month_week_report_v1",
  "status": "RUNNING",
  "createdAt": "2025-12-24T12:00:00Z",
  "updatedAt": "2025-12-24T12:00:20Z",
  "trigger": { "type": "SCHEDULER", "source": "flow1-every-4h" },
  "scope": { "symbol": "BTCUSDT" },
  "progress": {
    "currentStepId": "llm_report_1M_month_summary_v1",
    "stepCounts": { "total": 3, "pending": 0, "running": 0, "succeeded": 2, "failed": 0 }
  },
  "steps": {
    "ohlcv_1M_bigquery_all_v1": {
      "stepType": "OHLCV_EXPORT",
      "status": "SUCCEEDED",
      "timeframe": "1M",
      "createdAt": "2025-12-24T12:00:01Z",
      "finishedAt": "2025-12-24T12:00:05Z",
      "dependsOn": [],
      "inputs": {
        "source": "bigquery",
        "dataset": "raw_ohlcv",
        "symbol": "BTCUSDT",
        "timeframe": "1M",
        "exportMode": "all"
      },
      "outputs": {
        "gcs_uri": "gs://artifacts-bucket/20251224-120000_BTCUSDT_a1b2c/1M/ohlcv_1M_bigquery_all_v1.json"
      }
    },
    "charts_1M_default_set_v1": {
      "stepType": "CHART_EXPORT",
      "status": "SUCCEEDED",
      "timeframe": "1M",
      "createdAt": "2025-12-24T12:00:06Z",
      "finishedAt": "2025-12-24T12:00:12Z",
      "dependsOn": ["ohlcv_1M_bigquery_all_v1"],
      "inputs": {
        "minImages": 3,
        "requests": [{ "chartTemplateId": "ctpl_default_v1" }]
      },
      "outputs": {
        "gcs_uri": "gs://artifacts-bucket/20251224-120000_BTCUSDT_a1b2c/1M/charts_1M_default_set_v1.json"
      }
    },
    "llm_report_1M_month_summary_v1": {
      "stepType": "LLM_REPORT",
      "status": "READY",
      "timeframe": "1M",
      "createdAt": "2025-12-24T12:00:13Z",
      "dependsOn": ["ohlcv_1M_bigquery_all_v1", "charts_1M_default_set_v1"],
      "inputs": {
        "llm": {
          "promptId": "prompt_month_v1",
          "llmProfile": {
            "modelName": "gemini-2.0-flash",
            "temperature": 0.2,
            "maxOutputTokens": 2048,
            "responseMimeType": "application/json"
          }
        },
        "ohlcvStepId": "ohlcv_1M_bigquery_all_v1",
        "chartsManifestStepId": "charts_1M_default_set_v1",
        "previousReportStepIds": []
      },
      "outputs": {}
    }
  }
}
